id	image	latitude	longitude	timestamp	significance	text	fire	flood	person	animal	damage
1,images/image_1.png,40.7143,-74.006,2024-02-08 23:37:16,Processed,"The image shows a significant fire engulfing multiple buildings with flames visible through doors and windows creating a dangerous situation with potential structural collapse risks. A thick cloud of smoke is rising which could be hazardous for respiration and visibility. There are power lines overhead that may be compromised. In the foreground there are two children observing the scene suggesting the presence of civilians who might require evacuation and support. A fire truck is present indicating ongoing emergency response. Debris and personal belongings are scattered around signifying displacement and property damage. Immediate attention is necessary to control the fire prevent further damage and ensure the safety of residents and responders alike."
2,images/image_2.png,40.7143,-74.006,2024-02-08 23:38:30,Processed,"The image shows a large forest fire at night with tall trees engulfed in flames. The fire appears to be intense with a rich glow as it burns both the underbrush and the trees. No people or animals are visible suggesting the area may have been evacuated or is currently uninhabited. Thick smoke is likely reducing visibility and air quality this could pose respiratory hazards. The fire's brightness against the night sky indicates the size and intensity of the event high temperatures and rapid spread of the fire are likely increasing the danger to any nearby responders or dwellings. Immediate risks would include the fire's potential to spread further threatening more land and structures and the danger of embers causing spot fires at a distance from the main blaze."
3,images/image_3.png,40.7143,-74.006,2024-02-08 23:40:41,Processed,"The image shows an extensive field of debris from collapsed buildings and structures indicating a severe disaster such as an earthquake or explosion. There is a person visible lying down under a blanket in a makeshift shelter created with broken furniture and scattered household items. The person seems to be in a vulnerable condition potentially injured or resting and may require immediate assistance. Rescue workers should be cautious of unstable rubble sharp objects potential hazardous materials and the risk of aftershocks or further collapses. Immediate risks include potential hidden victims entrapment from shifting debris and exposure to elements for survivors."
4,images/image_4.png,40.7143,-74.006,2024-02-08 23:50:09,Processed,"The image shows significant flooding with high water levels as an adult woman wearing a yellow top and a patterned green and brown skirt is wading through water that reaches above her knees She is carrying a young child who is holding onto a cloth bag Possible risks include the dangers of drowning contaminated water leading to health hazards and the threat of being swept away by currents The visibility of the surrounding environment is limited indicating that submerged hazards may present additional risks Immediate rescue and support are required for the affected individuals to ensure their safety and access to clean water and shelter."
5,images/image_5.png,40.7143,-74.006,2024-02-08 23:52:16,Processed,"The image shows a severe flooding situation affecting a residential area. Multiple vehicles are submerged to varying extents indicating deep water levels. There are no visible people or animals in the immediate area but the water poses significant danger to anyone trapped or attempting to traverse on foot. The background shows houses that are likely impacted by water with potential damage to property and potential risk of collapse or structural failure due to prolonged exposure to water. Electrical lines are visible and could pose electrocution risks if lines are active and come in contact with the water. Immediate rescue efforts should prioritize ensuring no individuals are trapped in vehicles or buildings and disconnecting power to reduce the risk of electrocution. Secondary efforts should involve assessing the structural integrity of affected homes and providing assistance to residents who may be displaced or in need of aid."
6,images/image_6.png,40.7143,-74.006,2024-02-08 23:53:32,Processed,"This image depicts a severe flood scenario with multiple vehicles submerged in high water levels. The floodwaters appear to have completely inundated a residential area covering the roads and partly the surrounding houses. There are at least five visible cars that have been overtaken by the water with one car almost fully submerged. The presence of electrical lines above the water suggests potential electrical hazards. There are no visible people or animals in the immediate area. Emergency responders should be aware of the risk of additional flooding structural integrity concerns of the buildings and potential waterborne hazards. The need for water rescue resources and evaluation of the electrical grid in this area is critical for ensuring safety."
7,images/image_7.png,40.7143,-74.006,2024-02-09 00:50:10,Processed,"The image shows a scene of an urban area submerged in floodwater. A person is walking through the water in the center of the frame facing away from the viewer. They are wearing a backpack and appear to be moving through the flooded street cautiously. There are several vehicles partially underwater indicating that the flood depth is significant and may pose a risk to anyone trapped inside or attempting to pass through. There are downed trees and utility poles suggesting strong winds or water flow have damaged infrastructure which may present hazards like live electrical wires or unstable debris. The sky is overcast implying that the weather conditions may still be adverse. Visibility is reduced due to mist or persistent rainfall. This environment could be dangerous for anyone trying to navigate through it due to the depth and flow of floodwater hidden underwater obstacles and the potential for electrical hazards."
